{
  "object_type": "business_context",
  "osmm_version": "0.1.0",
  "business_id": "BIZ-warby-parker",
  "version": "1.0",
  "status": "draft",
  "name": "Warby Parker",
  "industry": "Consumer eyewear / optical retail",
  "business_type": "dtc",
  "founded": "2010",
  "hq_location": "New York, NY",
  "description": "Warby Parker is a vertically integrated, direct-to-consumer eyewear brand that designs its own glasses and sells them at accessible price points, having launched online to undercut the traditional optical industry. It has since grown into an omnichannel optical retailer with hundreds of stores, expanding from glasses into a broader holistic vision-care offering. It targets style-conscious, value-oriented consumers who want designer-quality eyewear without legacy markups.",
  "products_and_services": [
    "Prescription eyeglasses",
    "Sunglasses (prescription and non-prescription)",
    "Contact lenses",
    "Eye exams and vision tests (in-store and virtual)",
    "Blue-light and progressive lenses",
    "Accessories (cases, cleaning kits)"
  ],
  "value_proposition": "Designer-quality, well-designed eyewear at a fraction of legacy prices — with a frictionless way to try before you buy and a built-in social mission.",
  "target_customers": [
    "Style-conscious millennials and Gen Z buying their own eyewear",
    "Value-oriented consumers frustrated by traditional optical markups",
    "First-time and repeat prescription-glasses wearers seeking convenience",
    "Socially-minded shoppers who value the brand's give-back model"
  ],
  "revenue_model": "Direct-to-consumer e-commerce plus owned omnichannel retail stores; eye exams and vision services as an attach and acquisition driver",
  "scale_context": {
    "revenue_range": "$250M–1B",
    "revenue_mix_notes": "Glasses are the core revenue driver; contacts, exams, and accessories are growing attach categories. Retail stores now contribute a majority of revenue alongside the original e-commerce channel.",
    "growth_trajectory": "Steady double-digit revenue growth driven primarily by new store openings and holistic vision-care expansion; working toward sustained profitability post-IPO"
  },
  "business_model_notes": "Vertically integrated: designs frames in-house and controls the supply chain to cut out licensing middlemen, enabling a low entry price (historically around $95). The Home Try-On program (five frames shipped free) and Virtual Vision Test reduce the friction of buying glasses online. 'Buy a Pair, Give a Pair' distributes a pair to someone in need for every pair sold. Began as pure DTC e-commerce and has become omnichannel, with retail stores now a primary growth lever. Public company (NYSE: WRBY) since its 2021 direct listing.",
  "market_position": "Category challenger that disrupted legacy optical incumbents; premium-accessible brand with strong design and mission-driven differentiation",
  "competitors": ["EssilorLuxottica (LensCrafters, Pearle Vision, Ray-Ban)", "Zenni Optical", "GlassesUSA", "Costco Optical", "traditional independent optometrists"],
  "competitive_differentiators": [
    "Vertically integrated model enables designer-quality frames at a structurally lower price than incumbents",
    "Strong, design-led consumer brand with high affinity among younger buyers — rare in a historically commoditized category",
    "Home Try-On and virtual vision tools remove the friction that kept eyewear from selling well online",
    "Mission-driven 'Buy a Pair, Give a Pair' program reinforces brand preference and loyalty"
  ],
  "marketing_objectives": [
    "Drive new-customer acquisition into both e-commerce and the growing retail footprint",
    "Grow attach and repeat purchase across contacts, exams, and additional pairs",
    "Build awareness of Warby Parker as a holistic vision-care destination, not only a glasses brand",
    "Reinforce brand affinity and the give-back mission with younger consumers"
  ],
  "marketing_challenges": [
    "Educating consumers that eyewear can be bought confidently online and that Warby Parker now offers full vision care",
    "Rising customer acquisition costs across paid digital channels",
    "Balancing the original DTC brand story with an increasingly store-led growth model",
    "Competing against both ultra-low-cost online players and entrenched insurance-tied optical incumbents"
  ],
  "strategic_priorities": [
    "Expand the retail store footprint as the primary growth engine",
    "Broaden holistic vision care (exams, contacts, insurance acceptance) to increase lifetime value",
    "Advance the path to sustained profitability as a public company",
    "Deepen omnichannel integration between e-commerce and stores"
  ],
  "brand_tone_notes": "Approachable, witty, and design-forward — confident and culturally fluent without being exclusionary; mission-minded but light-touch about it",
  "key_markets": ["United States", "Canada"],
  "linked_brand_context": "BRC-PLACEHOLDER-warby-parker",
  "source": "Built from public information: Warby Parker public company filings (Form 10-K), warbyparker.com, and public reporting (2024). Figures expressed as order-of-magnitude bands, not exact filings."
}
